id;author/id;author/name;author/url;taxonomies/ids;participatory_space/id;participatory_space/url;component/id;title/ca;title/en;title/machine_translations/es;body/ca;body/en;body/machine_translations/es;address;latitude;longitude;state;state_published_at;reference;answer/en;answer/ca;answer/es;answered_at;votes;endorsements/total_count;endorsements/user_endorsements;comments;attachments;follows_count;published_at;url;meeting_urls;related_proposals;is_amend;original_proposal/title;original_proposal/url;withdrawn;withdrawn_at;created_at;updated_at;created_in_meeting;coauthorships_count;cost;cost_report;execution_period;title/es;original_proposal/title/ca;original_proposal/title/en;original_proposal/title/machine_translations/es
3;1;Nightly Decidim;https://nightly.decidim.org/;"";1;https://nightly.decidim.org/processes/premium-horizon;7;Itaque perferendis.;Architecto laborum.;Expedita nemo.;Velit quo reiciendis.;Incidunt facilis omnis.;Ut totam animi.;8995 Wilkinson Highway 97842 Moenfurt;-83.49252110256795;-64.28833998779858;rejected;2025-01-29 11:08:58 UTC;NIGHT-PROP-2025-01-3;"";"";"";2025-01-29 11:08:58 UTC;0;18;Ty Boyle, Sen. Edison Streich, Hye Leuschke, Logan Sanford, Evalyn Mante, Tracy Powlowski, Dorthea Bernier IV, Hiram Cassin, Pres. Nicolas Weber, Leo Stroman, Lidia Senger, Nyla Kihn, Penney Rutherford Sr., Gail Kozey, Mickey Leuschke, Caleb Johnson, Joe Johnson, Rep. Don Mayer;1;0;0;2025-01-29 11:08:58 UTC;https://nightly.decidim.org/processes/premium-horizon/f/7/proposals/3;"";"";false;;;false;;2025-01-29 11:08:58 UTC;2025-01-29 11:10:55 UTC;false;1;;;;;;;
4;1;Nightly Decidim;https://nightly.decidim.org/;"";1;https://nightly.decidim.org/processes/premium-horizon;7;Adipisci quo.;Reprehenderit eum.;In voluptas.;Qui commodi ut.;Dolorem harum voluptatem.;Non quia sit.;934 Robin Vista 11337 Lake Lesville;51.456034207059304;20.113594702741892;"";;NIGHT-PROP-2025-01-4;"";"";"";;0;29;Thu Gerhold, Darrick Kirlin I, Hee Mayert, Winston McClure, Keila Roberts, Katelin Shanahan DO, Merlin Crona, Paige Koelpin II, Lucien Fadel, Marianela Kovacek, Nelly Jacobs JD, Miss Kathern Frami, Justine Bergstrom, Alexander Morissette, Malisa Swaniawski III, Jayson Reilly, Mose Jaskolski, Wanda Jacobs, Armand Buckridge, Kaitlyn Carroll, Ka Veum, Merle Hettinger, Charisse Abernathy, Briana Parker, Benny Jast, The Hon. Erick Daniel, Arla Collier JD, Randolph D'Amore, Jerold Herman;8;0;0;2025-01-29 11:09:01 UTC;https://nightly.decidim.org/processes/premium-horizon/f/7/proposals/4;"";"";false;;;false;;2025-01-29 11:09:01 UTC;2025-01-29 11:09:01 UTC;false;1;;;;;;;
5;24;Rod Bartell II;https://nightly.decidim.org/profiles/benjamin-ffce2635;"";1;https://nightly.decidim.org/processes/premium-horizon;7;;;;Nemo unde id. At animi odio. Iure dolor consequatur.;Officiis inventore amet. Quod omnis id. Non ex fugiat.;"Tempore blanditiis id. Harum voluptas nostrum. Eligendi eos
pariatur.";;;;evaluating;;NIGHT-PROP-2025-01-5;"";"";"";2025-01-29 11:09:01 UTC;1;46;Breann Beahan DC, Josiah Collins, Akiko Frami, Terrence Dibbert CPA, Sen. Randy Kunde, Rema Harvey DO, Ettie Pagac, Reid Runolfsdottir, Mose Jaskolski, Jodi Macejkovic DO, Rep. Sharyn Abbott, Dewayne O'Reilly, Darron Hegmann, Buck Leffler, Msgr. Rusty Haley, Philip Smith MD, Gladys Moen, Gwen Kunze, Norris VonRueden, Kristofer Mitchell, The Hon. Clarence Rohan, Marceline Orn, Miss Vergie Abbott, The Hon. Marcellus Jakubowski, Yuriko Mueller, Buster Ankunding, Chrystal Schinner, Lidia Senger, Christia Legros MD, Elroy Bosco, Burton Ratke, Miss Moriah Schroeder, Joye Hettinger, Chong Erdman, Owen Hermiston, Gordon Conroy Sr., Aubrey Keebler PhD, Leilani Keebler, Prof. Tamera Koss, Claudio Kovacek, Jami Jerde, Myles McLaughlin, Jackeline Kling, Lee Frami, Tommye Marquardt, Hermila Fisher;0;0;1;2025-01-29 11:09:01 UTC;https://nightly.decidim.org/processes/premium-horizon/f/7/proposals/5;"";"";true;;https://nightly.decidim.org/processes/premium-horizon/f/7/proposals/4;false;;2025-01-29 11:09:01 UTC;2025-01-29 11:09:01 UTC;false;1;;;;;Adipisci quo.;Reprehenderit eum.;In voluptas.
6;24;Gov. Marna Johnston;https://nightly.decidim.org/profiles/ashly-8907;"";1;https://nightly.decidim.org/processes/premium-horizon;7;Hic quasi.;Omnis quisquam.;Amet facilis.;Expedita fugit culpa.;Harum distinctio aperiam.;Consequatur animi aliquam.;812 Swaniawski Station 06800-0968 Yundtland;-66.93569275490567;4.357387966967707;"";;NIGHT-PROP-2025-01-6;"";"";"";;1;42;The Hon. Gene Torphy, Garrett Greenholt, Ebonie Erdman, Fr. Odis Muller, Eugene Rippin, Tabitha Zemlak, Heather Cassin, Florrie Kuhlman, Nikia Bradtke, Rep. Cedric Welch, Charlie Lindgren, Racheal Bednar, Tamie Larkin, Dr. Adan Heathcote, Roxane Little, Miss Britni Tremblay, Cherilyn Bernhard Jr., Milford Rath, Jena Walsh, Mrs. Timothy Mohr, Damion Mosciski, Dong Osinski, Rep. Winter Beer, Giovanni Vandervort, Sen. Dannie Hodkiewicz, Stephenie Veum, Concepcion Hauck, Holly Wolf, Arlinda Schneider, Elicia Rippin MD, Keenan Murphy, Cristi Swaniawski, Albert Klein DO, Arron Corwin, Amb. Tory Sauer, Kip Ruecker, Gale Willms, Zola Harvey, Rosalee Fadel, Josette Monahan IV, Mrs. Blair Hoppe, Olinda White;10;0;1;2025-01-29 11:09:03 UTC;https://nightly.decidim.org/processes/premium-horizon/f/7/proposals/6;"";"";false;;;false;;2025-01-29 11:09:03 UTC;2025-01-29 11:09:04 UTC;false;1;;;;;;;
7;27;Valentine Hyatt;https://nightly.decidim.org/profiles/annabelle-fd705fdc;"";1;https://nightly.decidim.org/processes/premium-horizon;7;;;;"Laborum officia soluta. Consequatur pariatur voluptatem. Omnis
commodi minus.";Temporibus accusamus et. Rerum dolores ea. Non ut consequatur.;"Eligendi asperiores laudantium. Adipisci repudiandae earum. Ad
libero provident.";;;;evaluating;;NIGHT-PROP-2025-01-7;"";"";"";2025-01-29 11:09:03 UTC;1;11;Israel King, Sal Kuhic, Viva Ratke, Adelle Rolfson, Dillon Ullrich DC, Ms. Humberto Ledner, Kenny Lehner, Octavio Torp Jr., Cara Shanahan, Frida Kiehn, Savannah Bosco;0;0;1;2025-01-29 11:09:03 UTC;https://nightly.decidim.org/processes/premium-horizon/f/7/proposals/7;"";"";true;;https://nightly.decidim.org/processes/premium-horizon/f/7/proposals/6;false;;2025-01-29 11:09:03 UTC;2025-01-29 11:09:03 UTC;false;1;;;;;Hic quasi.;Omnis quisquam.;Amet facilis.
9;5;Kunde LLC;https://nightly.decidim.org/profiles/monty_sanford;"";2;https://nightly.decidim.org/processes/stuff-midnight;16;Labore sequi.;Voluptates quia.;Eum alias.;Maxime commodi animi.;Modi pariatur voluptate.;Qui et nobis.;61924 Claretta Stream 06926-7924 East Royce;5.396493349743082;-171.31332003834825;"";;NIGHT-PROP-2025-01-9;Sapiente exercitationem pariatur sed ad nostrum suscipit deleniti voluptatem illum.;Doloribus eius tempore placeat porro reprehenderit repellendus ea praesentium corrupti.;"";2025-01-29 11:10:48 UTC;1;41;Octavio Torp Jr., Charissa Becker, Rosio Schowalter, Isiah Cassin, Angeles Mraz, Daryl Bradtke, Yoshiko Marquardt, Micheline Lowe Jr., Tai Farrell, Ira Pollich, Shelley Schulist, Maryalice Kerluke DDS, Mrs. Kyla Bailey, Mallory McDermott VM, Franklyn Farrell, Dr. Carli Cummerata, Doreatha MacGyver Sr., Charolette Hammes, Ron Becker, Bryon Altenwerth II, Marica McDermott, Madeline Glover, Teresa Parisian, Pres. Leeanne Bernhard, Mr. Felecia Grant, The Hon. Holli Nikolaus, Nicholas Greenholt JD, Jody Wisoky, Miss Harvey Wisozk, Kathe Torphy, Sen. Sterling Beier, Sen. Freeda Hansen, Aaron Lubowitz, Amb. Vella Ziemann, Shirleen Weimann, Stephan Stiedemann DDS, Bruce Predovic, Ashely Padberg, Jonah Nicolas, Maurice McDermott, Simon Leannon;9;0;0;2025-01-29 11:10:48 UTC;https://nightly.decidim.org/processes/stuff-midnight/f/16/proposals/9;"";"";false;;;false;;2025-01-29 11:10:48 UTC;2025-01-29 11:10:51 UTC;false;1;;;;;;;
10;19;Nemo vel.;https://nightly.decidim.org/processes/stuff-midnight/f/14/meetings/19;"";2;https://nightly.decidim.org/processes/stuff-midnight;16;Ut et.;Veritatis praesentium.;Aut maxime.;Harum architecto reprehenderit.;Est totam temporibus.;Perspiciatis voluptas architecto.;51656 Willow Spur 56877 O'Connertown;-46.25291231347995;-152.90509146610972;"";;NIGHT-PROP-2025-01-10;"";"";"";;2;25;Nolan Kshlerin, Wilbur Haag, Marva Armstrong, Dillon Franecki JD, Rev. Deangelo Nader, September O'Hara, Rev. Treva Willms, Louisa O'Reilly, Scarlet Watsica, Morris Ebert, Sylvester Halvorson, Sen. Edison Streich, Irina Brown, Vi Russel, Rep. Salvatore Larson, Ula Schmeler, Loren Wehner CPA, Bridget Hintz, Sen. Randy Kunde, Lavina Kohler, The Hon. Marcellus Jakubowski, Juan Carter, Gregorio Deckow II, Tresa Altenwerth DO, Leandra Feeney;1;0;0;2025-01-29 11:10:51 UTC;https://nightly.decidim.org/processes/stuff-midnight/f/16/proposals/10;"";"";false;;;false;;2025-01-29 11:10:51 UTC;2025-01-29 11:10:52 UTC;false;1;;;;;;;
11;9;Walter-Friesen;https://nightly.decidim.org/profiles/daron;"";2;https://nightly.decidim.org/processes/stuff-midnight;16;Fugit quis.;Alias aut.;Temporibus vero.;Quos voluptate reprehenderit.;Velit sapiente doloribus.;At accusamus impedit.;774 Schultz Forges 46793-9069 Idellmouth;17.94556227527839;32.01830586835837;"";;NIGHT-PROP-2025-01-11;Neque facere ab id impedit aut nulla quas ipsum repudiandae.;Rerum placeat corporis eligendi quia voluptas voluptas dolores omnis adipisci.;"";2025-01-29 11:10:52 UTC;0;38;Sen. Mose Leuschke, Charlie Davis, Fransisca Torp, Miss Vergie Abbott, Hyman Will MD, Rev. Rema Johnston, Neil Hirthe, Pres. Ida Schiller, Jamey Renner, Charisse Abernathy, Amb. Kristan Bruen, Ariel Bayer, Lamonica Jast, Deandre Hettinger, Merlin Crona, Lakia Kozey, Wilburn Schmeler DDS, Dusty Franecki I, Alessandra Kirlin DVM, Roxane Little, Olivia Mertz, Gov. Minh Bosco, Kurtis Feil IV, Brandon Frami, Nery Grady, Mr. Misha Hayes, Jacquetta Beier, Adriane Waelchi, Marcell Kozey, Augusta Pacocha, Sol Schimmel, Elanor Davis, Serina Hilll, Dagny Moore, Erlinda Klocko, Launa Kozey, Pres. Valene Gusikowski, Alvin Kozey;0;0;0;2025-01-29 11:10:52 UTC;https://nightly.decidim.org/processes/stuff-midnight/f/16/proposals/11;"";"";false;;;false;;2025-01-29 11:10:52 UTC;2025-01-29 11:10:52 UTC;false;1;;;;;;;
12;1;Nightly Decidim;https://nightly.decidim.org/;"";2;https://nightly.decidim.org/processes/stuff-midnight;16;Doloremque eos.;Veniam voluptatem.;Culpa et.;Molestiae sunt aliquam.;Autem voluptas non.;Iusto tempora animi.;92580 Romaguera Brook 57156-5353 New Rethaland;-38.76348339693491;-24.33592069571054;"";;NIGHT-PROP-2025-01-12;Earum ex aliquam molestias pariatur sint provident nobis eum qui.;Natus quia enim qui eaque dolor hic neque repudiandae blanditiis.;"";2025-01-29 11:10:52 UTC;1;48;Gino Weissnat, Mr. Branden Walsh, Cole Schultz, Emile Bauch, Lakia Kozey, Rosetta Hettinger Sr., Lidia Senger, Rep. Kasey Stanton, Kandace Wiegand, Scottie Collins, Marty Wintheiser, Brendan Metz, Emilee Schuster, Israel King, Annalee Kuhic, Charlie Lindgren, Hye Leuschke, Fernando Batz, Flo Stroman, Rep. Torri Langworth, Thersa Blanda, Charla Stoltenberg, Bernadette Gleichner LLD, Mrs. Kyla Bailey, Anthony Erdman, Mikel Dooley, Jenine Miller, Shelley Schulist, Zachariah Huel MD, Carlo Moore, Darius D'Amore, Cristopher Jaskolski, Conrad Lockman, Helene Ritchie, Morris Ebert, Garret Macejkovic, Aracely Quigley Sr., Marianela Kovacek, Elke Torphy VM, Rocky Mohr, George Balistreri, The Hon. Clarence Rohan, Anneliese Walter, Leopoldo Schneider, Pam Rau, Wilfredo Balistreri, Pres. Napoleon Ward, Geraldo Terry;7;0;0;2025-01-29 11:10:52 UTC;https://nightly.decidim.org/processes/stuff-midnight/f/16/proposals/12;"";"";false;;;false;;2025-01-29 11:10:52 UTC;2025-01-29 11:10:54 UTC;false;1;;;;;;;
13;30;Amet qui.;https://nightly.decidim.org/assemblies/compete-scale/f/23/meetings/30;"";1;https://nightly.decidim.org/assemblies/compete-scale;25;Omnis harum.;Cupiditate molestias.;Ea necessitatibus.;Animi et voluptas.;Et corrupti non.;Dolore recusandae odio.;;;;"";;NIGHT-PROP-2025-01-13;Voluptatem explicabo voluptatem sint ut suscipit autem maiores earum perspiciatis.;Aut dolor molestiae alias provident sint quae et ratione voluptatem.;"";2025-01-29 11:12:10 UTC;0;31;Monte Larson, Teresa Parisian, Angila Hills, Gregorio Deckow II, Scott Mayer, Benito Yost, Curt Bayer, Thad Weissnat, Selena Adams, Mrs. Ralph Hartmann, Felton Senger, Franklyn Farrell, Lakia Kozey, Troy O'Hara I, Owen Hermiston, Blaine Marquardt, The Hon. Gene Torphy, Lieselotte Jakubowski, Rep. Kizzie Price, Chelsea Schultz, Msgr. Kassie Rowe, Ricardo Kautzer V, Nita Gleason, Stephan Stiedemann DDS, Cathey Kerluke, Gino Weissnat, Katina Koch, The Hon. Angelique Bruen, Saul Haley, Ha Ziemann PhD, Sen. Raymon Hickle;11;0;0;2025-01-29 11:12:10 UTC;https://nightly.decidim.org/assemblies/compete-scale/f/25/proposals/13;"";"";false;;;false;;2025-01-29 11:12:10 UTC;2025-01-29 11:12:14 UTC;false;1;;;;;;;
14;469;Mr. Elenora Roberts;https://nightly.decidim.org/profiles/vinnie_effertz-0de6a;"";1;https://nightly.decidim.org/assemblies/compete-scale;25;;;;"Asperiores voluptas eaque. Incidunt esse aut. Temporibus eius
error.";"Ratione hic error. Quo laborum necessitatibus. Magnam deleniti
iusto.";Dolorem dolor soluta. Eum nobis magni. Minima saepe voluptatem.;;;;evaluating;;NIGHT-PROP-2025-01-14;"";"";"";2025-01-29 11:12:10 UTC;1;18;Rae Olson, Alfonso Quitzon, Sen. Serita Torp, Lindsy Dare MD, Isreal Kohler, Joye Hettinger, Rev. Hassan Aufderhar, Rep. Gregg Schmeler, Pam Rau, Janette Goodwin, Juliette Rempel, Charlie Buckridge, Gwenn Champlin, Patti Erdman, Sergio Yost, Rep. Sharyn Abbott, Billy Homenick, Sen. Bess Hayes;0;0;1;2025-01-29 11:12:10 UTC;https://nightly.decidim.org/assemblies/compete-scale/f/25/proposals/14;"";"";true;;https://nightly.decidim.org/assemblies/compete-scale/f/25/proposals/13;false;;2025-01-29 11:12:10 UTC;2025-01-29 11:12:10 UTC;false;1;;;;;Omnis harum.;Cupiditate molestias.;Ea necessitatibus.
15;28;Valentine Hyatt;https://nightly.decidim.org/profiles/annabelle-fd705fdc;"";1;https://nightly.decidim.org/assemblies/compete-scale;25;Laboriosam consequatur.;Sed consequatur.;Eaque soluta.;Pariatur aut assumenda.;Rerum quae illum.;Excepturi tempore iure.;;;;evaluating;2025-01-29 11:12:15 UTC;NIGHT-PROP-2025-01-15;"";"";"";2025-01-29 11:12:15 UTC;1;27;Pres. Sook Raynor, Vincent Reynolds DO, Chere Borer, Tasha Williamson, Ryan Hermann, Marshall Auer, Kirk Haag I, Weston Ferry, Wilmer Mueller, Hong Prohaska, Ms. Aurelio Johns, Marlin Ledner, Whitney Bradtke, Prof. Stephaine Abshire, Asley Hammes, Vito Huels, Barabara Skiles, Helena Schoen, Sergio Yost, Dr. Rey Hodkiewicz, Amparo Goodwin, Jeremiah Bechtelar, Christia Legros MD, Jeffrey Pollich, Gilda Hammes, Kimbery Bogisich DO, Blondell Murray;9;0;0;2025-01-29 11:12:15 UTC;https://nightly.decidim.org/assemblies/compete-scale/f/25/proposals/15;"";"";false;;;false;;2025-01-29 11:12:15 UTC;2025-01-29 11:12:16 UTC;false;1;;;;;;;
16;177;Narcisa Lind;https://nightly.decidim.org/profiles/renay-3554;"";1;https://nightly.decidim.org/assemblies/compete-scale;25;Hic doloribus.;Magni nihil.;Dolor optio.;Eum modi enim.;Quo autem quae.;Animi libero laboriosam.;;;;"";;NIGHT-PROP-2025-01-16;"";"";"";;2;28;Yan Mayer, Gladys Moen, Marcell Kozey, Desiree Sanford, Alena Funk, Eric O'Reilly, Rolf Schowalter DC, Penney Rutherford Sr., Edmund Franecki, Sen. Bess Hayes, The Hon. Lyndon Sawayn, Lorene Olson, Charlott Ratke, Kimberlie Connelly, Monte Larson, The Hon. Wava Padberg, Lyndsay Glover DC, The Hon. Gene Torphy, Amb. Tristan Erdman, Indira Beer, Breann Beahan DC, Meridith Conroy, Donnell Frami, Msgr. Laure Cremin, Pres. Sook Raynor, Oswaldo Heidenreich, Nikia Bradtke, Courtney Powlowski DO;10;0;1;2025-01-29 11:12:16 UTC;https://nightly.decidim.org/assemblies/compete-scale/f/25/proposals/16;"";"";false;;;false;;2025-01-29 11:12:16 UTC;2025-01-29 11:12:19 UTC;false;1;;;;;;;
17;473;Verdell Olson;https://nightly.decidim.org/profiles/donnell-2e749993;"";1;https://nightly.decidim.org/assemblies/compete-scale;25;;;;Aut hic et. Aut pariatur id. Error a consequatur.;Eos sunt est. Ducimus rem possimus. Voluptatem distinctio enim.;Ad recusandae sed. Id labore aliquid. Iure animi qui.;;;;evaluating;;NIGHT-PROP-2025-01-17;"";"";"";2025-01-29 11:12:17 UTC;1;29;Kati Spencer, Lamonica Jast, Calvin Hagenes, Gisela Schmidt, Hong Bailey, Rafaela Murphy, Gaylene Hagenes, Harry Torphy, Eneida Towne III, Cathern Batz, Rep. Kasey Stanton, Garth Fritsch, Celia Mante Sr., Tommie O'Keefe, Kimbery Bogisich DO, Ali Zieme III, Kirstin Waelchi, Adela Effertz, Dedra Borer, Stanton McLaughlin Jr., Emmanuel Hackett, Jerry Schiller, Allen Ruecker, Grazyna Hermann, Louis Feeney DC, Christia Legros MD, Blondell Murray, Emery Osinski, Mr. Marvel Crooks;0;0;1;2025-01-29 11:12:17 UTC;https://nightly.decidim.org/assemblies/compete-scale/f/25/proposals/17;"";"";true;;https://nightly.decidim.org/assemblies/compete-scale/f/25/proposals/16;false;;2025-01-29 11:12:17 UTC;2025-01-29 11:12:17 UTC;false;1;;;;;Hic doloribus.;Magni nihil.;Dolor optio.
18;474;Verdell Olson;https://nightly.decidim.org/profiles/donnell-2e749993;"";1;https://nightly.decidim.org/assemblies/compete-scale;25;Aut sit.;Odio maxime.;Repellat quis.;Voluptatum reprehenderit qui.;Eos fuga magni.;Aspernatur magnam molestiae.;;;;evaluating;2025-01-29 11:12:19 UTC;NIGHT-PROP-2025-01-18;"";"";"";2025-01-29 11:12:19 UTC;0;10;Concepcion Hauck, Lamonica Jast, Jenni Cummings JD, Miss Harvey Wisozk, Gov. Latanya Herman, Armando Harvey, Dorthea Bernier IV, Ivan Hermiston, Shavon Dooley, Tona Rice;4;0;0;2025-01-29 11:12:19 UTC;https://nightly.decidim.org/assemblies/compete-scale/f/25/proposals/18;"";"";false;;;false;;2025-01-29 11:12:19 UTC;2025-01-29 11:12:19 UTC;false;1;;;;;;;
19;27;Maxime qui.;https://nightly.decidim.org/assemblies/compete-scale/f/23/meetings/27;"";1;https://nightly.decidim.org/assemblies/compete-scale;25;Sint et.;Aspernatur consequuntur.;Consequatur et.;Maxime aliquam beatae.;Veniam sint optio.;Ipsam quia ea.;;;;"";;NIGHT-PROP-2025-01-19;"";"";"";;1;12;Keila Roberts, Garth Fritsch, Shaquana VonRueden, Tashia Okuneva, Les Roberts, Lynna Gusikowski, Everett Wilkinson, Shirleen Weimann, Breanna Harris, Ashely Padberg, Garret McClure Sr., Deann Collier;0;0;0;2025-01-29 11:12:19 UTC;https://nightly.decidim.org/assemblies/compete-scale/f/25/proposals/19;"";"";false;;;false;;2025-01-29 11:12:19 UTC;2025-01-29 11:12:19 UTC;false;1;;;;;;;
20;478;Leoma Upton Esq.;https://nightly.decidim.org/profiles/conrad-12fa1235;"";1;https://nightly.decidim.org/assemblies/compete-scale;25;;;;Et aperiam sit. Consequatur vel officia. Dolore amet sequi.;"Dolore aperiam ullam. Blanditiis ut voluptatem. Corporis
cupiditate nulla.";"Excepturi ut at. Voluptatem temporibus tenetur. Praesentium
libero maxime.";;;;evaluating;;NIGHT-PROP-2025-01-20;"";"";"";2025-01-29 11:12:20 UTC;1;33;Versie Hermann, Rodrigo Marks VM, Anneliese Walter, Freda Auer, Elza Mohr, Tracy Powlowski, Jenine Miller, Fr. Jess Grimes, Hye Leuschke, Ermelinda O'Hara, Santo Powlowski, Pres. Salvatore Ratke, Eli Conn, Rev. Rema Johnston, Daniel Muller, Corrina Runte, Cristopher Upton MD, Holly Wolf, Tangela Murazik, Vivienne Kerluke VM, Miss Natalie Douglas, Susann Langosh, Bart Walter, Miss Wilfredo Welch, Doreatha MacGyver Sr., Ms. Patrick Waters, Jerome Spencer, Darrick Kirlin I, Dr. Tiara Wunsch, Jeffry Halvorson, Rep. Gaynell Mayer, Inger Lebsack, Aldo Corwin;0;0;1;2025-01-29 11:12:20 UTC;https://nightly.decidim.org/assemblies/compete-scale/f/25/proposals/20;"";"";true;;https://nightly.decidim.org/assemblies/compete-scale/f/25/proposals/19;false;;2025-01-29 11:12:20 UTC;2025-01-29 11:12:20 UTC;false;1;;;;;Sint et.;Aspernatur consequuntur.;Consequatur et.
21;1;Nightly Decidim;https://nightly.decidim.org/;"";2;https://nightly.decidim.org/assemblies/nursery-thirsty;34;Officia dolorem.;Molestias quas.;Sed rerum.;Officiis ut est.;Dignissimos ut asperiores.;Quia nihil non.;;;;accepted;2025-01-29 11:14:03 UTC;NIGHT-PROP-2025-01-21;Ab omnis et aut ea aut et sit porro voluptatum.;Eos quis libero consectetur similique dolor ipsam non dolorum quam.;"";2025-01-29 11:14:03 UTC;0;43;Booker Schaefer, Rev. Marco Kuvalis, Pres. Latosha Wehner, Pres. Shera Senger, Weston Nitzsche, Prof. Noella Konopelski, Amb. Fatimah Bernier, Alton Ward, Williams Hermann, Esteban Feest, Oswaldo Heidenreich, Prof. Hettie Gerhold, Sal Gislason Sr., Quinn Kuhic, Clyde Dickens, Narcisa Lind, Calvin Lesch, Shante Senger, Jacques Blick, Patti Erdman, Fernando Hamill, Chas Steuber DVM, Catherine Beatty, Fr. Robbie Donnelly, Yulanda Becker, Vivienne Kerluke VM, Tory Windler, Dr. Marianne Schoen, Francesca Rolfson, Myles McLaughlin, Wayne Stark, Ha Ziemann PhD, Sylvia Will, Nereida Howell PhD, Lucretia Fisher MD, Jamie Kozey, Willy Hegmann, Carmelo Walsh, Sol Schimmel, Felton Considine, Theron Schulist, Marvin Erdman, Janita Okuneva MD;9;1;0;2025-01-29 11:14:03 UTC;https://nightly.decidim.org/assemblies/nursery-thirsty/f/34/proposals/21;"";"";false;;;false;;2025-01-29 11:14:03 UTC;2025-01-29 11:14:04 UTC;false;1;;;;;;;
22;7;Barrows LLC;https://nightly.decidim.org/profiles/fonda_krajcik;"";2;https://nightly.decidim.org/assemblies/nursery-thirsty;34;Eligendi facilis.;Unde est.;Non quos.;Fugiat quis tenetur.;Est unde consequatur.;Esse deleniti exercitationem.;;;;"";;NIGHT-PROP-2025-01-22;"";"";"";;1;19;Marty Wintheiser, Mrs. Adria Baumbach, Ardis Padberg, Kelly Hudson, Tereasa O'Hara, Isiah Welch, Sen. Raymon Hickle, Nita Gleason, Max Carter V, Emery Osinski, Dustin Kuhn, Miss Whitney Streich, Kareem Borer, Lonny Botsford, Lavette Lueilwitz, Willian Koelpin, Stasia Wisozk, Gilda Hammes, Thu Gerhold;10;1;0;2025-01-29 11:14:05 UTC;https://nightly.decidim.org/assemblies/nursery-thirsty/f/34/proposals/22;"";"";false;;;false;;2025-01-29 11:14:05 UTC;2025-01-29 11:14:09 UTC;false;1;;;;;;;
23;36;Nesciunt nostrum.;https://nightly.decidim.org/assemblies/nursery-thirsty/f/32/meetings/36;"";2;https://nightly.decidim.org/assemblies/nursery-thirsty;34;Esse quasi.;Blanditiis eum.;Doloremque aut.;Nihil animi aut.;Tempore nemo qui.;Eveniet aliquam assumenda.;;;;"";;NIGHT-PROP-2025-01-23;Qui omnis sed omnis quod ad rerum est mollitia eos.;Repellendus maiores quis voluptatem beatae debitis aut doloribus quaerat rerum.;"";2025-01-29 11:14:09 UTC;2;12;Phillis Nienow, Scott Mayer, Jess Jerde, Rep. Felice Kassulke, Joi Lehner, Calvin Hagenes, Nelly Hauck, Jacqui Walsh III, Lucio Keeling, Eliza Adams, Dyan O'Keefe, Pres. Ida Schiller;1;1;0;2025-01-29 11:14:09 UTC;https://nightly.decidim.org/assemblies/nursery-thirsty/f/34/proposals/23;"";"";false;;;false;;2025-01-29 11:14:09 UTC;2025-01-29 11:14:09 UTC;false;1;;;;;;;
24;8;Schiller Inc;https://nightly.decidim.org/profiles/wanita;"";2;https://nightly.decidim.org/assemblies/nursery-thirsty;34;Molestiae recusandae.;Ut dignissimos.;Sit impedit.;Facilis ad vel.;Ex voluptas qui.;Voluptatem maxime tenetur.;;;;accepted;2025-01-29 11:14:10 UTC;NIGHT-PROP-2025-01-24;Quas quam mollitia ducimus architecto saepe nisi amet ex voluptatem.;Velit error vero doloribus qui voluptatem omnis accusantium temporibus earum.;"";2025-01-29 11:14:10 UTC;0;42;Boyd Lakin, Tracy Hodkiewicz DDS, Dr. Isiah Gorczany, Renita Buckridge, Reggie Abbott V, Evita Dibbert, Terrence Kunze, Savannah Bosco, Eliza Adams, Morris Ebert, Sharie Hackett, Mrs. Theo Howe, Leigh Renner, Sen. Serita Torp, Moriah Beier, Katerine Beatty, Mack Boyle, Gilda Hammes, Nicole Ondricka JD, Vergie Brekke, Elicia Rippin MD, Huey Murazik, Richie Oberbrunner, Garret McClure Sr., Josefina Crist, Sean Dare, Carlie Ritchie JD, Mr. Misha Hayes, Weston Ferry, Rep. Lea Lubowitz, Damien Abernathy, Nenita Osinski, Gregorio Deckow II, Annabel Fahey, Kiera Frami, Charlott Ratke, Prof. Irvin Stoltenberg, Aaron Lubowitz, Retha Stark, Felton Senger, Leandra Feeney, Andrea Jones;1;1;0;2025-01-29 11:14:10 UTC;https://nightly.decidim.org/assemblies/nursery-thirsty/f/34/proposals/24;"";"";false;;;false;;2025-01-29 11:14:10 UTC;2025-01-29 11:14:10 UTC;false;1;;;;;;;
25;1;Nightly Decidim;https://nightly.decidim.org/;"";2;https://nightly.decidim.org/assemblies/nursery-thirsty;34;Consequuntur vero.;Unde error.;Quasi sed.;Provident hic veniam.;Recusandae libero autem.;Id enim nihil.;;;;rejected;2025-01-29 11:14:12 UTC;NIGHT-PROP-2025-01-25;"";"";"";2025-01-29 11:14:12 UTC;0;4;Amina Stehr, Grant Thompson, Gail Padberg, Garrett Greenholt;8;1;0;2025-01-29 11:14:12 UTC;https://nightly.decidim.org/assemblies/nursery-thirsty/f/34/proposals/25;"";"";false;;;false;;2025-01-29 11:14:12 UTC;2025-01-29 11:14:13 UTC;false;1;;;;;;;
26;42;Laboriosam quaerat.;https://nightly.decidim.org/assemblies/rung-academy/f/41/meetings/42;"";3;https://nightly.decidim.org/assemblies/rung-academy;43;Nesciunt qui.;Ut porro.;Quia reiciendis.;Dolor provident quia.;Ea libero eos.;Ut porro omnis.;627 Barrows Views 42892 Wilhelminafort;87.2225489907469;128.02339825672874;evaluating;2025-01-29 11:15:38 UTC;NIGHT-PROP-2025-01-26;"";"";"";2025-01-29 11:15:38 UTC;0;32;Malorie Hintz, Maisha Kohler, Travis Little, Shaunte Zulauf, Magdalen Cormier, Mrs. Alex Cummings, Prof. Mari Marquardt, Billie Wilkinson, Israel King, Yuko Ondricka, Kieth Ankunding, Waylon Leffler, Star O'Conner, Tommye Marquardt, Anette Gibson III, Mr. Christin Hills, Lauretta White, Dillon Ullrich DC, Nelly Hauck, Lynetta Wilderman V, Sen. Barrie Parisian, Hien Homenick, Pres. Salvatore Ratke, Amina Stehr, Kristian Pfannerstill VM, Jimmie Kiehn, Mrs. Elena Lakin, Concepcion Price DC, Cheryll Ritchie, Val Schaden I, Mikki Corwin, Quinn Kuhic;8;1;0;2025-01-29 11:15:38 UTC;https://nightly.decidim.org/assemblies/rung-academy/f/43/proposals/26;"";"";false;;;false;;2025-01-29 11:15:38 UTC;2025-01-29 11:15:39 UTC;false;1;;;;;;;
