Début date;2020-04-22;;;
Fin date;2020-04-30;;;
Total abonnés;343;;;
Total propositions;421;;;
---;---;---;---;
;;Proposition;Votes;Themes
;;Nous devrions équiper les élèves avec un ordinateur portable pour éviter les inégalités de l'école à la maison. Et former les professeurs à donner des cours en ligne avec les outils adéquats.;19;Éducation
;;Nous devrions revaloriser les professions essentielles à la société en dégelant les grilles salariales de la fonction publique hospitalière;42;Santé
;;Nous devrions développer les cellules de soutien pour les personnes isolées (personnes âgées, sdf,...);23;Société et vivre ensemble
;;J'ai une idée ! Favoriser la vie de quartier entre les voisins proches et les commerçants alentours;14;Société et vivre ensemble
;;J'ai une idée ! Investir les personnes du « middle age » (50-70 ans) pour les occuper auprès des populations qui en ont besoin (personnes âgées & enfants - école, etc.);12;Société et vivre ensemble
;;Comment pourrions-nous communiquer plus et faire prendre des actions concrètes aux gouvernements pour l’environnement aux vues des résultats spectaculaires dû au confinement ?;18;Environnement et développement durable
;;J'ai une idée ! Favoriser une économie super locale et circulaire au sein des circuits de productions et de consommation  alimentaires avec des prix préférentiels pour les acteurs régionaux (agriculteurs, ateliers de transformation alimentaire, magasins  de proximité);43;Environnement et développement durable
;;Nous avons besoin d'une agriculture  plus autonome en termes d'intrants organiques (charger les communes des compétences de collecte, compostage et redistribution des déchets alimentaires), et ainsi réduire  l'import de fertilisant et diminuer d'1/3 les ordures des ménages;33;Environnement et développement durable
;;Nous avons besoin d'être consultés et associés pour prendre des décisions plus démocratiques.;19;Société et vivre ensemble
;;Je voudrais un LeBonCoin des solidarités.;13;Société et vivre ensemble
;;Comment pourrions-nous imposer un premier niveau de mobilisation solidaire sans mesures liberticides ?;5;Société et vivre ensemble
;;J'ai une idée ! les mairies pourraient elles mettre en place et officialiser certaines actions solidaires;16;Société et vivre ensemble,Éducation
;;Comment pourrions-nous Suggérer et surtout mettre en place vite les  idées de solidarité;6;Société et vivre ensemble,Éducation
;;J'ai une idée ! Aider les enfants qui n ont pas ou peu d accès à internet et se substituer aux parents;7;Éducation
;;Nous avons besoin Nous voulons des informations claires sur le de confinement de nos seniors et pouvoir les aider dans cette etape;6;Santé
;;J'ai une idée ! Relocaliser certaines lignes de production industrielles, qui peuvent se révéler essentielle en période de crise;32;Économie
;;J'ai une idée ! Créer la Déclaration des Devoirs de l’Homme , une charte du bon sens qui listerait des comportements intelligents et responsables permettant une meilleure cohabitation entre les Hommes et une meilleure façon d’habiter notre Terre.;24;Environnement et développement durable,Société et vivre ensemble
;;Ich habe eine Idee! Faire en sorte que l'Etat devienne  actionnaire des entreprises auxquelles il fait des prêts actuellement (et donc puisse recevoir des dividendes une fois que ces entreprises seront positives financièrement );15;Économie
;;J'ai une idée ! Faire des petites bibliothèques de villages de vrais lieux d'échanges communautaires et solidaires. Avec comme objectif d'apporter une culture écologique facile à mettre en place au sein du village ainsi qu'un brainstorming pour réfléchir à d'autres théme;16;Culture, sport et loisirs
;;I have an idea ! Constituer un annuaire des commerces indépendants de son quartier et ayant une démarche locale et respectueuse de l'environnement  pour encourager l' économie locale et durable;22;Environnement et développement durable
;;J'ai une idée ! Dans les zones industrielles et d'activités et pour toutes autres constructions, éviter de bétonner le sol mais préférer le gravier pour laisser s'infiltrer la pluie et ainsi éviter les inondations, faire des toits végétaux et récupérer l'eau de pluie;44;Environnement et développement durable
;;J'ai une idée ! Garantir que chaque industrie ait la possibilité de trouver un fournisseur français en 1. Aidant les entreprises à relocaliser leur production ou 2. Soutenir des entrepreneurs pour recréer ces maillons de la chaîne de valeur manquants;22;Économie
;;J'ai une idée ! Equilibrer la balance écologique des transports en taxant davantage les transports les plus polluants, afin de privilégier les modes de transport avec l'empreinte écologique la plus faible.;43;Économie
;;We should instaurer un revenu citoyen inconditionnel qui serve de socle de protection sociale et qui soit à la fois un droit social minimum inscrit dans la constitution et un revenu découplé de l'emploi.;26;Économie
;;"We should Partager le temps de travail : Passer au 32h  et favoriser la semaine de 4 jours à la carte,
Avec maintient du salaire et 10% d'embauches en CDI";20;Économie
;;Nous avons besoin de replacer l'humain au coeur des décisions;16;Société et vivre ensemble
;;Je voudrais Tirer des bonnes leçon de cette crise sanitaire et profiter de son impact environnemental pour à notre tour agir pour l’écologie;20;Environnement et développement durable
;;Nous avons besoin de pistes cyclables dignes de ce nom partout dans la ville ainsi que des parkings à vélos;44;Transports et Mobilité
;;Nous devrions transformer nos centre-villes en végétalisant,  bannir la voiture individuelle, repenser la mobilité urbaine commune et renforcer les échanges de proximité.;46;Transports et Mobilité
;;Nous devrions renforcer les échanges entre producteurs locaux et consommateurs. Favoriser l'agriculture, urbaine, péri-urbaine et bien-sûr biologique;37;Environnement et développement durable
;;"Nous avons besoin de consommer mieux et moins. Valoriser le travail essentiel des métiers ""principaux"" (soins, éducation, alimentation, transport, déchets et revalorisation, énergies propres, etc...)";37;Économie
;;Nous avons besoin De développer à grande échelle les transports non polluants, en:;18;Transports et Mobilité
;;Nous avons besoin développant le ferroutage, les aménagements cyclables, les transports en commun;28;Transports et Mobilité
;;Nous avons besoin de relocaliser la production de produits essentiels: médicaments et matériel médical, agriculture et alimentation, textile etc.;29;Transports et Mobilité
;;Comment pourrions-nous Utiliser la carte Vitale et le DMP (dossier médical partagé) pour gérer le suivi des tests et des malades covid 19;3;Santé
;;Nous avons besoin de revaloriser (financièrement et socialement) les métiers et fonctions utiles et favorisant économie locale et lien social: aide à la personne, agriculture (biologique et locale), éducation et culture, travail sanitaire et social, artisanat au sens large;21;Société et vivre ensemble,Économie
;;Nous devrions Réorienter les aides financières et subventions vers les entreprises et initiatives locales et résiliantes (notamment dans les domaines des transport, de l'industrie et de l'agriculture);20;Environnement et développement durable,Économie
;;Nous devrions Faciliter les initiatives solidaires et les activités essentielles socialement avec un revenu universel inconditionnel;12;Société et vivre ensemble,Économie
;;Je voudrais Faciliter encore plus le développement de la vie associative;12;Société et vivre ensemble
;;Je voudrais maintenir et même développer les actions de distribution de fruits et légumes issus des circuits courts;22;Environnement et développement durable
;;Nous devrions Redévelopper dans les grandes agglomérations des halles couvertes proposant des produits locaux et zéro déchet remplaçant à 100% la consomation de grande surface. Elles pourraient intégrer la mise à disposition des paniers de producteur.;22;Économie
;;Nous devrions Former des groupes de travail de citoyens (créatif et collaboratif) dans chaque localité pour inventer notre futur commun en y incluant la résilience et notre autosuffisance;14;Société et vivre ensemble
;;J'ai une idée ! Réserver des rues entières, ou presque aux vélo. Faire un maillage de toute la ville beaucoup plus puissant pour circuler que des pistes cyclabes, passer à 30% de mobilité par le vélo;27;Transports et Mobilité
;;J'ai une idée ! Favoriser le télétravail lorsque cela est possible: ce qui permets de limiter les déplacements (gain de temps de transport et mesure écologique) et permet de faciliter l'articulation entre vie personnelle et vie professionnelle;23;Environnement et développement durable,Économie
;;Nous devrions Avoir des espaces publiques ouverts (places publique, forum), lieux de rassemblements extérieur ou chacun (et n'importe qui!) pourrait participer à des débats publics et trouver de nouvelles idées, à des horaires autres que celles de travail habituel;7;Société et vivre ensemble
;;J'ai une idée ! Développer les aires de covoiturage dans tout le territoire (nottamment dans les territoires ruraux) pour favoriser le covoiturage à l'intérieur des territoires ruraux et vers les gares TER;8;Transports et Mobilité
;;J'ai une idée ! Lutter contre les déserts médicaux, développer le systeme docariv.fr sur tout le territoire;7;Santé
;;J'ai une idée ! Augmenter les salaires des soignants du secteur hospitalier d'au moins 10% (difficile de fidéliser certains professionnels qui partent en libéral ou dans le privé où les salaires sont nettement plus attractifs);20;Santé,Économie
;;J'ai une idée ! Développer les Unités Mobiles Evaluation Gériatriques (ergothérapeutes, assistantes sociales, IDE, etc) qui se déplacent au domicile de patients âgés afin de mettre en place les aides (humaines et matérielles) utiles au maintien à domicile;13;Société et vivre ensemble,Santé
;;J'ai une idée ! Développer le nombre de places en crèches publiques. Faire garder son enfant pour travailler ne doit pas être un luxe;12;Société et vivre ensemble,Enfants et famille
;;J'ai une idée ! Favoriser les projets d'habitat intergénérationnel;20;Société et vivre ensemble,Urbanisme et aménagement
;;Nous avons besoin que les supermarchés continuent à ne vendre, en priorité, que des produits français pour soutenir durablement notre économie, l'agriculture française, les industries françaises...;8;Économie
;;Nous avons besoin D'humanisation.L'économie de marché à outrance a eu un effet boule de neige devastateur sur la santé,l'éducation, l'environnement et la sécurité. Plus de circuits courts de consommation et démarchandisation des services vitaux.;11;
;;J'ai une idée ! Il faudrait obliger les hypermachés à récupérer les déchets recyclables avec un tri plus fin que dans les poubelles à domicile. IL faudrait que les gens prennent l'habitude de ramener leurs emballages à recycler au moment où ils font leur courses.;11;Environnement et développement durable
;;I have an idea ! remettre en place les consignes pour les bouteilles;18;Environnement et développement durable
;;I have an idea ! financer la réouverture d'entreprise de produit de  1ere nécessité dans ce type de crise ( blouse, masque, gel). cf ancienne entreprise en Bretagne. Aider son financement avec les peages qui ont remboursé leurs autoroutes depuis un bail;7;Santé
;;Comment pourrions nous être prêts au dé-confinement envisagé pour le 11 mai?  Le statistiques disent que le nombre de personnes infectées est en baisse mais à date les tampons ne sont pas effectués à tous ceux qui présentent des symptômes.;1;Santé
;;peu de gens ont contracté le virus et donc il n'y a pas encore un niveau d'immunité suffisant pour être protégés  même si le dé-confinement sera   progressif en utilisant les gestes barrieres, et pour les enfants pareils.;0;Santé
;;Il faut attendre des soins et des vaccins sûrs et sans risques pour sortir au bon moment du confinement. Il faut réfléchir et  imaginer des nouveaux espaces économiques avec des différentes emplois pour redémarrer le pays.;0;Santé
;;Bâtir le futur signifie surtout comprendre que des nouvelles pandémies viendront dans les années prochaines puisque le changement climatique et l'extinction des animaux produisent que ça.;1;Santé
;;Il y a encore du travail et des études à faire avant de parler de date pour s'en sortir. Concentrons-nous tous sur les bonnes priorités.;0;Santé
;;Nous avons besoin De devenir suffisant à l'échelle européen, en matière d'énergie !;5;Environnement et développement durable
;;Je voudrais que l'état n'apporte pas des aides en entreprises qui redistribuent des dividendes à leurs actionnaires;17;Économie
;;Nous devrions imaginer de nouvelles mobilités pour de pas sombrer dans les futures crises pétrolières qui seront inéluctables !;19;Transports et Mobilité
;;Apprenons à donner une part à chacun ! Arretons de rendre les gens riches encore plus riches !;19;Société et vivre ensemble
;;Nous avons besoin de payer des gars pour taper derrière un ballon ? Moi ils ne me manquent pas;7;Culture, sport et loisirs
;;Je voudrais pouvoir travailler moins pour voir grandir mes enfants.;8;Enfants et famille
;;Nous devrions nous rendre compte de l’inutilité de la fonction publique non soignante et passer son effectif de 5 millions a 2,5 millions Que d'économie ! cette crise a bien mise en évidence le parasitisme de tous ces administratifs.;2;Économie
;;J'ai une idée ! Financer la relance économique par une taxe très lourde sur la pub §;4;Économie
;;J'ai une idée ! Arrêter le commerce des animaux sauvages;15;Environnement et développement durable
;;J'ai une idée ! Interdire les cours de la bourse sur l'eau et les ressources alimentaires;18;Environnement et développement durable
;;J'ai une idée ! Retrouver l'autonomie alimentaire de la région;16;Environnement et développement durable
;;J'ai une idée ! Ecouter les scientifiques qui proposent d'arrêter l'érosion de la biodiversité;8;Environnement et développement durable
;;J'ai une idée ! Proposer un ouais binaire pour toute la famille sur l’environnement la protection la préservation l’économie de l’eau le réchauffement climatique lee recyclage;1;Environnement et développement durable
;;We should créer une taxe sur l'ensemble des produits en fonction du nombre de kilomètres parcourus depuis leur lieu de fabricatio (qu'ils soient de première nécessité ou non). Cela aurait plusieurs objectifs : favoriser le local, écologique, relocaliser en france;25;Environnement et développement durable
;;J'ai une idée ! Re-localiser la production des médicaments afin d'éviter les ruptures de stock et la dépendance à la Chine et l'Inde.;29;Économie
;;Nous avons besoin de contrôler notre consommation d'eau et de mettre en place un vrai plan de récupération des eaux de pluie. Le rhône vient d'être déclaré en état de sécheresse. C'est la 5eme année consécutive. Il est urgent d'agir !;27;Environnement et développement durable
;;Nous devrions ne plus acheter nos fruits et légumes en grande surface et favoriser à l'échelle de chaque commune le sproducteurs locaux. Le circuit court permet de moins polluer, d'avoir des produits frais de qualité et de saison et d'assurer un revenu digne de ce nom;30;Environnement et développement durable
;;Nous avons besoin Il faut que la production de tous les matériaux se fassent en France car nous avons eu une pénurie de matériel pour les soignants, il faut que les français se remettent au travail rapidement car notre économie est déficitaire.;7;Économie
;;Promouvoir la création de petites exploitations paysannes diversifiées, biologiques voire permaculturelles, pour garantir notre indépendance alimentaire régionale, créer de l'emploi, sauvegarder les sols et la biodiversité, mieux manger et moins polluer !;24;
;;J'ai une idée ! On pourrait continuer l'entraide entre voisins, qui s'est mise en place naturellement pendant le confinement. Renouer du lien social !;10;Société et vivre ensemble
;;J'ai une idée ! On devrait obliger les banques à plus de transparence sur l'utilisation de nos épargne et les catégories de financement choisis (éthique ou non, développement durable ou non etc.);16;Économie
;;J'ai une idée ! On devrait interdire toute coupe d'arbre en ville et interdire de les ratiboiser en leur coupant toutes les branches !;3;Environnement et développement durable
;;J'ai une idée ! Le gouvernement pourrait supprimer toutes les subventions sur le transport aérien et les déplacer sur le transport ferroviaire;19;Transports et Mobilité
;;Je voudrais profiter du confinement pour que les transports aériens soient drastiquement réduits;14;Transports et Mobilité
;;J'ai une idée ! On pourrait interdire au niveau national les choses aberrantes types: chauffage des terrasses en hiver, magasins/bureaux allumés toute la nuit, publicité à outrance sur écrans... Cela permettrait de limiter un minimum d’énergie;28;Environnement et développement durable
;;J'ai une idée ! On pourrait taxer les entreprises sur leurs consommations énergétiques: le nombre de trajets en avion réalisés dans l’année, la consommation d’électricité ou d’eau... pour dissuader les excès;14;Environnement et développement durable
;;J'ai une idée ! Déplacer les subventions donnes à l’agriculture conventionnelle pour les donner à l’agriculture biologique et Perma culture et adapter les formations dans de ce domaine;21;Environnement et développement durable
;;J'ai une idée ! Il faudrait lever un impôt spécifique de solidarité pour les entreprise qui ont vu leur chiffre d'affaire exploser suite aux ventes en ligne de produits ne relevant pas de première nécessité;6;Économie
;;J'ai une idée ! Il faudrait reprendre la main sur les banques qui ne respectent pas les consignes gouvernementales;7;Économie
;;J'ai une idée ! Obliger la mise en vente d’appareils électroniques RÉPARABLES (pas seulement mettre un indice de reparabilité);23;Environnement et développement durable
;;J'ai une idée ! Arrêter le développement de la 5G;13;Environnement et développement durable
;;J'ai une idée ! Il faut impérativement lancer un programme de revalorisation des métiers des services à la personne quel qu'il soit si nous voulons créer une société plus humaine;11;Société et vivre ensemble
;;J'ai une idée ! Il faut réintroduire les leçons d'initiation à l'hygiène chez les enfants et à tous les niveaux;6;Éducation
;;J'ai une idée ! Il faut remettre en visibilité les métiers manuels;13;Éducation
;;J'ai une idée ! Il faut réintroduire les notions de cuisine et d'alimentation saine auprès des enfants dès le plus jeune âge;15;Éducation
;;J'ai une idée ! il faudrait rembourser les dépenses de médecines douces, le plus souvent moins coûteuses et très efficaces;4;Santé
;;J'ai une idée ! Intégrer des notions de naturopathie dans le parcours des médecins;5;Santé
;;Nous avons besoin Il est absolument nécessaire de maintenir la qualité des radios et chaînes publiques pour faire face aux rumeurs et aux faux prophètes. Le gouvernement est en train de réfléchir à la nouvelle contribution audio-visuelle.;13;Société et vivre ensemble
;;"J'ai une idée ! faciliter l'accès aux solutions préventives ""de terrain"" comme l'homéopathie, la naturopathie,....";5;Santé
;;Nous devrions vérifier que les petites entreprises sont vraiment aidées et moins les grandes si elles versent des dividendes alors que leurs salariés sont en chômage partiel et qu'elles investissent sans respecter nos valeurs sociales.;22;Économie
;;J'ai une idée ! Lancer des études sur les jeûnes thérapeutiques;2;Santé
;;Comment pourrions-nous modifier les circuits de décisions qui vont toujours de la société d'en haut vers celle du bas?Il faut que les instances de discussion s'ouvrent avec plus de concertation et une vraie concertation.;6;Société et vivre ensemble
;;Je voudrais qui a commandé cette consultation et qui la finance ?;1;
;;Nous avons besoin de relocaliser notre alimentation, de respecter les saisons, de complètement revoir la PAC en privilégiant les subventions pour les agriculteurs qui réduisent considérablement leur impact environnemental, d'encourager la permaculture en France;35;Environnement et développement durable
;;Nous devrions réduire le temps de travail afin de partager le travail qui se fera de plus en plus rare durant cette crise sanitaire puis économique;10;Économie
;;Nous avons besoin de valoriser financièrement et socialement les professions essentielles de notre société (santé, alimentaire, nettoyage, entretien, livraison, agriculture etc...) lors de l'orientation et de la réorientation professionnelle;23;Économie
;;Nous avons besoin de placer en priorité l'écologie d'un point de vue juridique dans chaque action, individuelle ou collective, pour éviter que des projets écocides soient menés à leur terme et engager des poursuites si nécessaire;29;Environnement et développement durable
;;Nous avons besoin de créer plus de filières locales pour notre alimentation et notre bien-être, pour encourager la consommation de produits locaux (fruits et légumes, mais aussi huiles végétales, céréales, légumineuses, plantes médicinales etc..);30;Environnement et développement durable
;;Nous avons besoin de réduire considérablement notre consommation d'énergie pour in fine réduire notre production d'énergie (que ce soit par les particuliers, les entreprises ou encore par des mesures gouvernementales, tout le monde est concerné !);16;Environnement et développement durable
;;Nous devrions valoriser le bénévolat de manière plus appuyée afin de créer du lien social, de venir en aide aux personnes démunies, de se responsabiliser, de participer à la gestion d'une commune toujours sur la base du volontariat bien sûr;13;Société et vivre ensemble
;;Nous devrions accer notre systeme de soin sur la prevention, booster notre immunité ? bien manger (des produits de saisons, bio, locaux), bien dormir ( sans pollution sonore, visuelle, energetique , bien respirer (consciemment, profondement) gerer ces emotions;9;Santé
;;Nous devrions réduire le temps de travail afin de dégager du temps pour ce qui nous plaît vraiment, pour faire plus facilement du bénévolat, pour passer plus de temps en famille, pour se réapproprier notre travail et notre temps;13;Société et vivre ensemble
;;Nous avons besoin de faciliter la réorientation et la reprise d'études suite à cette crise qui va probablement générer des remises en question notamment sur le plan professionnel;16;Éducation
;;Nous devrions solliciter la collectivité (qui est plus légitime qu'un habitant seul) à créer des espaces d'échanges autour de thématiques diverses comme le zéro déchets, ou la co-éducation;6;Société et vivre ensemble
;;"Nous devrions favoriser l'accès au logement décent pour les plus démuns (y compris les étudiants) décents : loyers accessibles et aidés, surface correcte et envorinnement ""non ghetto"".";15;Urbanisme et aménagement
;;Nous avons besoin de reconstituer le maillage des services sociaux dans les quartiers : permanences d'assistant(e)s sociaux, des PMI (protection maternelle et infantile) de planification familiale, qui sont les pare-feu aux violences et au sectarisme;21;Société et vivre ensemble
;;Nous avons besoin de reconstituer les services psychiâtrique de secteur : CMP enfants et CMP adultes avec du personnel spécialisé apte à recevoir tous les jours pour répondre aux énormes besoins des souffrances psy.;17;Santé
;;Comment pourrions-nous accueillie décemment les réfugiés : hébergement, soins, accès à notre culture, mettre à profit leurs compétences et leur culture pour améliorer leurs conditions de vie et la nötre par conséquent : échanges et partages.;23;Société et vivre ensemble
;;Je voudrais que nous retrouvions la conscience que payer des impôts est un acte civique et responsable pour rémunérer des fonctionnaires qui par leur travail garantissent l'éducation, la santé, la paix sociale pour tous.;30;Société et vivre ensemble
;;Nous avons besoin actuellement il ya des ventes directes mais en drive et dans des lieux éloignés. Pourquoi pas des regroupements de producteurs livrant tout au long de l'année els commandes personnalisées (pas des paniers generalistes) dans des magasins de proximité.;11;Économie
;;J'ai une idée ! Démarchandisation: faire que les biens communs essentiels à la vie (SSEE:Santé,Sécurité,Education,Environnemen)ne soit plus traduit sur le marché. Qu'il ne fassent plus l'objet de gains individuels et sortent  de toutes logiques de profit.;19;Économie
;;I have an idea ! Autoriser  la construction d'habitats légers respectueux de la nature sur des terrains sauvages et non-constructibles, comme au pays de Galles (maisons en matériaux locaux: bois, terre, paille...) afin de faciliter l'accès au logement;15;Urbanisme et aménagement
;;Je voudrais créer des lotissements seniors sécurisés avec les infrastructures nécessaire pour un maintien à domicile des personnes âgées non-dépendantes.;7;
;;Je voudrais qu'une Loi soit vôtée pour obliger tous les constructeurs d'immeubles et de maisons individuelles à planter un nombre d'arbres proportionnellement à la surface construite.;21;Environnement et développement durable
